{
  "schemaVersion": 1,
  "initializedFrom": {
    "package": "puppeteer",
    "version": "24.36.1"
  },
  "classes": [
    "Accessibility",
    "BrowserLauncher",
    "CDPSession",
    "CSSCoverage",
    "Connection",
    "ConnectionClosedError",
    "ConsoleMessage",
    "Coverage",
    "DeviceRequestPrompt",
    "Dialog",
    "ElementHandle",
    "EventEmitter",
    "ExtensionTransport",
    "FileChooser",
    "Frame",
    "HTTPRequest",
    "HTTPResponse",
    "JSCoverage",
    "JSHandle",
    "Keyboard",
    "Locator",
    "Mouse",
    "ProtocolError",
    "PuppeteerError",
    "PuppeteerNode",
    "ScreenRecorder",
    "SecurityDetails",
    "Target",
    "TimeoutError",
    "TouchError",
    "Touchscreen",
    "Tracing",
    "UnsupportedOperation",
    "WebWorker"
  ],
  "members": [
    "Browser.addScreen",
    "Browser.browserContexts",
    "Browser.close",
    "Browser.connected",
    "Browser.cookies",
    "Browser.debugInfo",
    "Browser.defaultBrowserContext",
    "Browser.deleteCookie",
    "Browser.deleteMatchingCookies",
    "Browser.emit",
    "Browser.getWindowBounds",
    "Browser.installExtension",
    "Browser.isConnected",
    "Browser.listenerCount",
    "Browser.newPage",
    "Browser.off",
    "Browser.on",
    "Browser.once",
    "Browser.pages",
    "Browser.process",
    "Browser.removeAllListeners",
    "Browser.removeScreen",
    "Browser.screens",
    "Browser.setCookie",
    "Browser.setWindowBounds",
    "Browser.target",
    "Browser.targets",
    "Browser.uninstallExtension",
    "Browser.userAgent",
    "Browser.version",
    "Browser.waitForTarget",
    "Browser.wsEndpoint",
    "BrowserContext.browser",
    "BrowserContext.clearPermissionOverrides",
    "BrowserContext.closed",
    "BrowserContext.cookies",
    "BrowserContext.deleteCookie",
    "BrowserContext.deleteMatchingCookies",
    "BrowserContext.emit",
    "BrowserContext.id",
    "BrowserContext.listenerCount",
    "BrowserContext.off",
    "BrowserContext.on",
    "BrowserContext.once",
    "BrowserContext.overridePermissions",
    "BrowserContext.pages",
    "BrowserContext.removeAllListeners",
    "BrowserContext.setCookie",
    "BrowserContext.targets",
    "BrowserContext.waitForTarget",
    "Page.$",
    "Page.$$",
    "Page.$$eval",
    "Page.$eval",
    "Page.accessibility",
    "Page.addScriptTag",
    "Page.addStyleTag",
    "Page.authenticate",
    "Page.bluetooth",
    "Page.bringToFront",
    "Page.browser",
    "Page.browserContext",
    "Page.click",
    "Page.close",
    "Page.content",
    "Page.cookies",
    "Page.coverage",
    "Page.createCDPSession",
    "Page.createPDFStream",
    "Page.deleteCookie",
    "Page.emit",
    "Page.emulate",
    "Page.emulateCPUThrottling",
    "Page.emulateFocusedPage",
    "Page.emulateIdleState",
    "Page.emulateMediaFeatures",
    "Page.emulateMediaType",
    "Page.emulateNetworkConditions",
    "Page.emulateTimezone",
    "Page.emulateVisionDeficiency",
    "Page.evaluateHandle",
    "Page.evaluateOnNewDocument",
    "Page.exposeFunction",
    "Page.focus",
    "Page.frames",
    "Page.getDefaultNavigationTimeout",
    "Page.getDefaultTimeout",
    "Page.goBack",
    "Page.goForward",
    "Page.hover",
    "Page.isClosed",
    "Page.isDragInterceptionEnabled",
    "Page.isJavaScriptEnabled",
    "Page.isServiceWorkerBypassed",
    "Page.keyboard",
    "Page.listenerCount",
    "Page.locator",
    "Page.mainFrame",
    "Page.metrics",
    "Page.mouse",
    "Page.off",
    "Page.on",
    "Page.once",
    "Page.openDevTools",
    "Page.pdf",
    "Page.queryObjects",
    "Page.reload",
    "Page.removeAllListeners",
    "Page.removeExposedFunction",
    "Page.removeScriptToEvaluateOnNewDocument",
    "Page.resize",
    "Page.screencast",
    "Page.screenshot",
    "Page.select",
    "Page.setBypassCSP",
    "Page.setBypassServiceWorker",
    "Page.setCacheEnabled",
    "Page.setContent",
    "Page.setCookie",
    "Page.setDefaultNavigationTimeout",
    "Page.setDefaultTimeout",
    "Page.setDragInterception",
    "Page.setExtraHTTPHeaders",
    "Page.setGeolocation",
    "Page.setJavaScriptEnabled",
    "Page.setOfflineMode",
    "Page.setRequestInterception",
    "Page.setUserAgent",
    "Page.setViewport",
    "Page.tap",
    "Page.target",
    "Page.title",
    "Page.touchscreen",
    "Page.tracing",
    "Page.type",
    "Page.url",
    "Page.viewport",
    "Page.waitForDevicePrompt",
    "Page.waitForFileChooser",
    "Page.waitForFrame",
    "Page.waitForFunction",
    "Page.waitForNavigation",
    "Page.waitForNetworkIdle",
    "Page.waitForRequest",
    "Page.waitForResponse",
    "Page.waitForSelector",
    "Page.windowId",
    "Page.workers",
    "Puppeteer::clearCustomQueryHandlers",
    "Puppeteer::customQueryHandlerNames",
    "Puppeteer::registerCustomQueryHandler",
    "Puppeteer::unregisterCustomQueryHandler"
  ],
  "exports": [
    "BrowserContextEvent",
    "BrowserEvent",
    "CDPSessionEvent",
    "DEFAULT_INTERCEPT_RESOLUTION_PRIORITY",
    "InterceptResolutionAction",
    "KnownDevices",
    "LocatorEvent",
    "MouseButton",
    "PageEvent",
    "PredefinedNetworkConditions",
    "Protocol",
    "Session",
    "TargetType",
    "connect",
    "default",
    "defaultArgs",
    "executablePath",
    "launch",
    "trimCache"
  ]
}
